{
  "$schema": "https://json-schema.org/draft/2020-12/schema",
  "$id": "https://skrodzkai.github.io/agentic-peopleos/schemas/evidence-manifest.schema.json",
  "title": "Agentic PeopleOS Evidence Manifest",
  "description": "A deterministic claims-to-evidence graph for one generated artifact.",
  "type": "object",
  "additionalProperties": false,
  "required": [
    "schema_version",
    "artifact",
    "sources",
    "transformations",
    "assumptions",
    "checks",
    "caveats",
    "claims",
    "reviews",
    "decisions"
  ],
  "properties": {
    "schema_version": {"const": "1.0"},
    "artifact": {"$ref": "#/$defs/artifact"},
    "sources": {"type": "array", "items": {"$ref": "#/$defs/source"}},
    "transformations": {"type": "array", "items": {"$ref": "#/$defs/transformation"}},
    "assumptions": {"type": "array", "items": {"$ref": "#/$defs/assumption"}},
    "checks": {"type": "array", "items": {"$ref": "#/$defs/check"}},
    "caveats": {"type": "array", "items": {"$ref": "#/$defs/caveat"}},
    "claims": {"type": "array", "items": {"$ref": "#/$defs/claim"}},
    "reviews": {"type": "array", "items": {"$ref": "#/$defs/review"}},
    "decisions": {"type": "array", "items": {"$ref": "#/$defs/decision"}}
  },
  "$defs": {
    "id": {"type": "string", "pattern": "^(?![\\s\\S]*[\\r\\n])[a-z0-9][a-z0-9._:@/-]{0,159}$"},
    "date": {"type": "string", "pattern": "^(?![\\s\\S]*[\\r\\n])[0-9]{4}-[0-9]{2}-[0-9]{2}$", "format": "date"},
    "stamp": {"type": "string", "pattern": "^(?![\\s\\S]*[\\r\\n])[0-9]{4}-[0-9]{2}-[0-9]{2}T[0-9]{2}:[0-9]{2}:[0-9]{2}Z$", "format": "date-time"},
    "hash": {"type": "string", "pattern": "^(?![\\s\\S]*[\\r\\n])sha256:[0-9a-f]{64}$"},
    "scalar": {"type": ["string", "number", "integer", "boolean", "null"]},
    "idList": {"type": "array", "uniqueItems": true, "items": {"$ref": "#/$defs/id"}},
    "artifact": {
      "type": "object",
      "additionalProperties": false,
      "required": ["id", "agent_id", "title", "artifact_type", "as_of", "period", "status", "semantic_hash"],
      "properties": {
        "id": {"$ref": "#/$defs/id"},
        "agent_id": {"$ref": "#/$defs/id"},
        "title": {"type": "string", "minLength": 1},
        "artifact_type": {"enum": ["dashboard", "digest", "report", "dataset", "decision_packet"]},
        "as_of": {"$ref": "#/$defs/date"},
        "period": {"type": "string", "minLength": 1},
        "status": {"enum": ["draft", "reviewed", "approved", "published", "withdrawn"]},
        "semantic_hash": {"$ref": "#/$defs/hash"}
      }
    },
    "source": {
      "type": "object",
      "additionalProperties": false,
      "required": ["id", "label", "kind", "uri", "version", "as_of", "classification", "content_hash", "hash_scope"],
      "properties": {
        "id": {"$ref": "#/$defs/id"},
        "label": {"type": "string", "minLength": 1},
        "kind": {"enum": ["dataset", "filing", "model", "policy", "registry", "report", "manual_input"]},
        "uri": {"type": "string", "minLength": 1, "maxLength": 2000, "pattern": "^(?![\\s\\S]*[\\r\\n])(repo:|https?://|urn:).+"},
        "version": {"type": "string", "minLength": 1},
        "as_of": {"$ref": "#/$defs/date"},
        "classification": {"enum": ["synthetic", "public", "internal", "confidential", "restricted"]},
        "content_hash": {"$ref": "#/$defs/hash"},
        "hash_scope": {"enum": ["file_bytes", "canonical_record", "source_version"]}
      }
    },
    "transformation": {
      "type": "object",
      "additionalProperties": false,
      "required": ["id", "name", "version", "implementation", "description"],
      "properties": {
        "id": {"$ref": "#/$defs/id"},
        "name": {"type": "string", "minLength": 1},
        "version": {"type": "string", "minLength": 1},
        "implementation": {"type": "string", "minLength": 1},
        "description": {"type": "string", "minLength": 1}
      }
    },
    "assumption": {
      "type": "object",
      "additionalProperties": false,
      "required": ["id", "name", "value", "unit", "version", "status", "source_ids"],
      "properties": {
        "id": {"$ref": "#/$defs/id"},
        "name": {"type": "string", "minLength": 1},
        "value": {"$ref": "#/$defs/scalar"},
        "unit": {"type": "string", "minLength": 1},
        "version": {"type": "string", "minLength": 1},
        "status": {"enum": ["illustrative", "approved", "policy", "observed"]},
        "source_ids": {"$ref": "#/$defs/idList"}
      }
    },
    "check": {
      "type": "object",
      "additionalProperties": false,
      "required": ["id", "name", "status", "implementation", "details", "attestation", "source_ids"],
      "properties": {
        "id": {"$ref": "#/$defs/id"},
        "name": {"type": "string", "minLength": 1},
        "status": {"enum": ["passed", "failed", "not_run"]},
        "implementation": {"type": "string", "minLength": 1},
        "details": {"type": "string", "minLength": 1},
        "attestation": {"enum": ["producer", "independent"]},
        "source_ids": {"$ref": "#/$defs/idList"}
      }
    },
    "caveat": {
      "type": "object",
      "additionalProperties": false,
      "required": ["id", "severity", "text"],
      "properties": {
        "id": {"$ref": "#/$defs/id"},
        "severity": {"enum": ["info", "warning", "blocking"]},
        "text": {"type": "string", "minLength": 1}
      }
    },
    "changeDriver": {
      "type": "object",
      "additionalProperties": false,
      "required": ["type", "label", "effect", "unit"],
      "properties": {
        "type": {"enum": ["business_change", "population_change", "source_correction", "logic_change", "assumption_change", "definition_change", "restatement", "unknown"]},
        "label": {"type": "string", "minLength": 1},
        "effect": {"type": ["number", "null"]},
        "unit": {"type": "string", "minLength": 1}
      }
    },
    "change": {
      "type": "object",
      "additionalProperties": false,
      "required": ["prior_claim_id", "prior_value", "prior_display_value", "absolute", "percent", "comparability", "drivers"],
      "properties": {
        "prior_claim_id": {"oneOf": [{"$ref": "#/$defs/id"}, {"type": "null"}]},
        "prior_value": {"$ref": "#/$defs/scalar"},
        "prior_display_value": {"type": "string", "minLength": 1},
        "absolute": {"type": ["number", "null"]},
        "percent": {"type": ["number", "null"]},
        "comparability": {"enum": ["comparable", "definition_changed", "not_comparable", "not_available"]},
        "drivers": {"type": "array", "items": {"$ref": "#/$defs/changeDriver"}}
      }
    },
    "claim": {
      "type": "object",
      "additionalProperties": false,
      "required": ["id", "claim_type", "metric_id", "statement", "value", "display_value", "unit", "period", "as_of", "material", "status", "source_ids", "transformation_id", "assumption_ids", "check_ids", "supporting_claim_ids", "caveat_ids", "change"],
      "properties": {
        "id": {"$ref": "#/$defs/id"},
        "claim_type": {"enum": ["metric", "narrative", "disclosure"]},
        "metric_id": {"oneOf": [{"$ref": "#/$defs/id"}, {"type": "null"}]},
        "statement": {"type": "string", "minLength": 1},
        "value": {"$ref": "#/$defs/scalar"},
        "display_value": {"type": "string", "minLength": 1},
        "unit": {"type": "string", "minLength": 1},
        "period": {"type": "string", "minLength": 1},
        "as_of": {"$ref": "#/$defs/date"},
        "material": {"type": "boolean"},
        "status": {"enum": ["supported", "caveated", "blocked"]},
        "source_ids": {"$ref": "#/$defs/idList"},
        "transformation_id": {"oneOf": [{"$ref": "#/$defs/id"}, {"type": "null"}]},
        "assumption_ids": {"$ref": "#/$defs/idList"},
        "check_ids": {"$ref": "#/$defs/idList"},
        "supporting_claim_ids": {"$ref": "#/$defs/idList"},
        "caveat_ids": {"$ref": "#/$defs/idList"},
        "change": {"oneOf": [{"$ref": "#/$defs/change"}, {"type": "null"}]}
      }
    },
    "review": {
      "type": "object",
      "additionalProperties": false,
      "required": ["id", "status", "actor_role", "reviewed_at", "claim_ids", "notes"],
      "properties": {
        "id": {"$ref": "#/$defs/id"},
        "status": {"enum": ["reviewed", "approved", "rejected"]},
        "actor_role": {"type": "string", "minLength": 1},
        "reviewed_at": {"$ref": "#/$defs/stamp"},
        "claim_ids": {"$ref": "#/$defs/idList"},
        "notes": {"type": "string", "minLength": 1}
      }
    },
    "decision": {
      "type": "object",
      "additionalProperties": false,
      "required": ["id", "decision_type", "status", "owner_role", "decided_at", "artifact_id", "claim_ids", "notes"],
      "properties": {
        "id": {"$ref": "#/$defs/id"},
        "decision_type": {"type": "string", "minLength": 1},
        "status": {"enum": ["proposed", "approved", "rejected", "deferred", "implemented"]},
        "owner_role": {"type": "string", "minLength": 1},
        "decided_at": {"$ref": "#/$defs/stamp"},
        "artifact_id": {"$ref": "#/$defs/id"},
        "claim_ids": {"$ref": "#/$defs/idList"},
        "notes": {"type": "string", "minLength": 1}
      }
    }
  }
}
