{
  "artifact": {
    "agent_id": "agent.executive-comp-peer-builder",
    "artifact_type": "dashboard",
    "as_of": "2026-07-02",
    "id": "artifact.executive-comp-peer-builder.report",
    "period": "FY2026 proxy season",
    "semantic_hash": "sha256:0db09c59ccce85e5727c9496c40578c98c2e7dc140d99dd4675dbe6be0a48024",
    "status": "draft",
    "title": "Acme Corp Executive Compensation Peer Group"
  },
  "assumptions": [
    {
      "id": "assumption.executive-comp-peer-builder.reference-mode",
      "name": "Reference data mode",
      "source_ids": [
        "source.executive-comp-peer-builder.01",
        "source.executive-comp-peer-builder.02"
      ],
      "status": "observed",
      "unit": "mode",
      "value": "synthetic",
      "version": "v1"
    }
  ],
  "caveats": [
    {
      "id": "caveat.executive-comp-peer-builder.reference-mode",
      "severity": "warning",
      "text": "Real public-peer observations with a synthetic subject; the committee approves membership."
    }
  ],
  "checks": [
    {
      "attestation": "producer",
      "details": "The agent completed its schema, finite-value, reconciliation, and domain-specific output guards before evidence generation",
      "id": "check.executive-comp-peer-builder.report-contract",
      "implementation": "examples.executive-comp-peer-builder.run.build_report",
      "name": "Agent report contract",
      "source_ids": [
        "source.executive-comp-peer-builder.01",
        "source.executive-comp-peer-builder.02"
      ],
      "status": "passed"
    }
  ],
  "claims": [
    {
      "as_of": "2026-07-02",
      "assumption_ids": [
        "assumption.executive-comp-peer-builder.reference-mode"
      ],
      "caveat_ids": [
        "caveat.executive-comp-peer-builder.reference-mode"
      ],
      "change": null,
      "check_ids": [
        "check.executive-comp-peer-builder.report-contract"
      ],
      "claim_type": "metric",
      "display_value": "85",
      "id": "claim.executive-comp-peer-builder.closest-fit",
      "material": true,
      "metric_id": null,
      "period": "FY2026 proxy season",
      "source_ids": [
        "source.executive-comp-peer-builder.01",
        "source.executive-comp-peer-builder.02"
      ],
      "statement": "Closest peer size-fit score: 85.",
      "status": "caveated",
      "supporting_claim_ids": [],
      "transformation_id": "transform.executive-comp-peer-builder.report.v1",
      "unit": "score",
      "value": 84.8
    },
    {
      "as_of": "2026-07-02",
      "assumption_ids": [
        "assumption.executive-comp-peer-builder.reference-mode"
      ],
      "caveat_ids": [
        "caveat.executive-comp-peer-builder.reference-mode"
      ],
      "change": null,
      "check_ids": [
        "check.executive-comp-peer-builder.report-contract"
      ],
      "claim_type": "metric",
      "display_value": "12",
      "id": "claim.executive-comp-peer-builder.core",
      "material": true,
      "metric_id": null,
      "period": "FY2026 proxy season",
      "source_ids": [
        "source.executive-comp-peer-builder.01",
        "source.executive-comp-peer-builder.02"
      ],
      "statement": "Recommended core peer group size: 12.",
      "status": "caveated",
      "supporting_claim_ids": [],
      "transformation_id": "transform.executive-comp-peer-builder.report.v1",
      "unit": "companies",
      "value": 12
    },
    {
      "as_of": "2026-07-02",
      "assumption_ids": [
        "assumption.executive-comp-peer-builder.reference-mode"
      ],
      "caveat_ids": [
        "caveat.executive-comp-peer-builder.reference-mode"
      ],
      "change": null,
      "check_ids": [
        "check.executive-comp-peer-builder.report-contract"
      ],
      "claim_type": "metric",
      "display_value": "16",
      "id": "claim.executive-comp-peer-builder.in-band",
      "material": true,
      "metric_id": null,
      "period": "FY2026 proxy season",
      "source_ids": [
        "source.executive-comp-peer-builder.01",
        "source.executive-comp-peer-builder.02"
      ],
      "statement": "In-band peer candidates: 16.",
      "status": "caveated",
      "supporting_claim_ids": [],
      "transformation_id": "transform.executive-comp-peer-builder.report.v1",
      "unit": "companies",
      "value": 16
    },
    {
      "as_of": "2026-07-02",
      "assumption_ids": [
        "assumption.executive-comp-peer-builder.reference-mode"
      ],
      "caveat_ids": [
        "caveat.executive-comp-peer-builder.reference-mode"
      ],
      "change": null,
      "check_ids": [
        "check.executive-comp-peer-builder.report-contract"
      ],
      "claim_type": "metric",
      "display_value": "19th",
      "id": "claim.executive-comp-peer-builder.subject-percentile",
      "material": true,
      "metric_id": null,
      "period": "FY2026 proxy season",
      "source_ids": [
        "source.executive-comp-peer-builder.01",
        "source.executive-comp-peer-builder.02"
      ],
      "statement": "Synthetic subject revenue percentile in the in-band group: 19th.",
      "status": "caveated",
      "supporting_claim_ids": [],
      "transformation_id": "transform.executive-comp-peer-builder.report.v1",
      "unit": "percentile",
      "value": 19
    },
    {
      "as_of": "2026-07-02",
      "assumption_ids": [
        "assumption.executive-comp-peer-builder.reference-mode"
      ],
      "caveat_ids": [
        "caveat.executive-comp-peer-builder.reference-mode"
      ],
      "change": null,
      "check_ids": [
        "check.executive-comp-peer-builder.report-contract"
      ],
      "claim_type": "metric",
      "display_value": "$852M",
      "id": "claim.executive-comp-peer-builder.subject-revenue",
      "material": true,
      "metric_id": null,
      "period": "FY2026 proxy season",
      "source_ids": [
        "source.executive-comp-peer-builder.01",
        "source.executive-comp-peer-builder.02"
      ],
      "statement": "Synthetic subject revenue: $852M.",
      "status": "caveated",
      "supporting_claim_ids": [],
      "transformation_id": "transform.executive-comp-peer-builder.report.v1",
      "unit": "USD",
      "value": 851567000
    },
    {
      "as_of": "2026-07-02",
      "assumption_ids": [
        "assumption.executive-comp-peer-builder.reference-mode"
      ],
      "caveat_ids": [
        "caveat.executive-comp-peer-builder.reference-mode"
      ],
      "change": null,
      "check_ids": [
        "check.executive-comp-peer-builder.report-contract"
      ],
      "claim_type": "metric",
      "display_value": "50",
      "id": "claim.executive-comp-peer-builder.universe",
      "material": true,
      "metric_id": null,
      "period": "FY2026 proxy season",
      "source_ids": [
        "source.executive-comp-peer-builder.01",
        "source.executive-comp-peer-builder.02"
      ],
      "statement": "Public companies screened: 50.",
      "status": "caveated",
      "supporting_claim_ids": [],
      "transformation_id": "transform.executive-comp-peer-builder.report.v1",
      "unit": "companies",
      "value": 50
    },
    {
      "as_of": "2026-07-02",
      "assumption_ids": [
        "assumption.executive-comp-peer-builder.reference-mode"
      ],
      "caveat_ids": [
        "caveat.executive-comp-peer-builder.reference-mode"
      ],
      "change": null,
      "check_ids": [
        "check.executive-comp-peer-builder.report-contract"
      ],
      "claim_type": "metric",
      "display_value": "4",
      "id": "claim.executive-comp-peer-builder.watchlist",
      "material": true,
      "metric_id": null,
      "period": "FY2026 proxy season",
      "source_ids": [
        "source.executive-comp-peer-builder.01",
        "source.executive-comp-peer-builder.02"
      ],
      "statement": "In-band alternate watchlist size: 4.",
      "status": "caveated",
      "supporting_claim_ids": [],
      "transformation_id": "transform.executive-comp-peer-builder.report.v1",
      "unit": "companies",
      "value": 4
    }
  ],
  "decisions": [],
  "reviews": [],
  "schema_version": "1.0",
  "sources": [
    {
      "as_of": "2026-07-02",
      "classification": "public",
      "content_hash": "sha256:e1acfdb3e7fbb89fbe7cfcd8908ba325ab1b287b1fbc2e733218e23d29b19afa",
      "hash_scope": "file_bytes",
      "id": "source.executive-comp-peer-builder.01",
      "kind": "dataset",
      "label": "Peer Universe",
      "uri": "repo:foundation/data/acme/peer_universe.csv",
      "version": "reference-2026-07-02"
    },
    {
      "as_of": "2026-07-02",
      "classification": "public",
      "content_hash": "sha256:1e5e23a6bbfc3f21802af30d37c6e2870ac602fb0596ad2bcad4e2c1e6312207",
      "hash_scope": "file_bytes",
      "id": "source.executive-comp-peer-builder.02",
      "kind": "policy",
      "label": "Real Peer Data",
      "uri": "repo:governance/real-peer-data.md",
      "version": "reference-2026-07-02"
    }
  ],
  "transformations": [
    {
      "description": "Read validated source data, enforce the agent's fail-closed report contract, and produce the semantic report model",
      "id": "transform.executive-comp-peer-builder.report.v1",
      "implementation": "examples.executive-comp-peer-builder.run.build_report",
      "name": "Peer eligibility screen and size-fit ranking",
      "version": "v1"
    }
  ]
}
