{
  "artifact": {
    "agent_id": "agent.pay-equity",
    "artifact_type": "dashboard",
    "as_of": "2026-01-31",
    "id": "artifact.pay-equity.report",
    "period": "January 2026 pay-equity snapshot",
    "semantic_hash": "sha256:737a948244f2a91e44766fb2d07e9cf451182758df269506dbfc0d43dc9d4348",
    "status": "draft",
    "title": "Acme Corp Pay-Equity Readiness Screen"
  },
  "assumptions": [
    {
      "id": "assumption.pay-equity.reference-mode",
      "name": "Reference data mode",
      "source_ids": [
        "source.pay-equity.01"
      ],
      "status": "observed",
      "unit": "mode",
      "value": "synthetic",
      "version": "v1"
    }
  ],
  "caveats": [
    {
      "id": "caveat.pay-equity.reference-mode",
      "severity": "warning",
      "text": "Synthetic, pseudonymised base-pay analysis; EU screen is readiness guidance, not a legal determination."
    }
  ],
  "checks": [
    {
      "attestation": "producer",
      "details": "The agent completed its schema, finite-value, reconciliation, and domain-specific output guards before evidence generation",
      "id": "check.pay-equity.report-contract",
      "implementation": "examples.pay-equity.run.build_report",
      "name": "Agent report contract",
      "source_ids": [
        "source.pay-equity.01"
      ],
      "status": "passed"
    }
  ],
  "claims": [
    {
      "as_of": "2026-01-31",
      "assumption_ids": [
        "assumption.pay-equity.reference-mode"
      ],
      "caveat_ids": [
        "caveat.pay-equity.reference-mode"
      ],
      "change": null,
      "check_ids": [
        "check.pay-equity.report-contract"
      ],
      "claim_type": "metric",
      "display_value": "+0.4%",
      "id": "claim.pay-equity.adjusted",
      "material": true,
      "metric_id": null,
      "period": "January 2026 pay-equity snapshot",
      "source_ids": [
        "source.pay-equity.01"
      ],
      "statement": "Like-for-like adjusted gender pay gap: +0.4%.",
      "status": "caveated",
      "supporting_claim_ids": [],
      "transformation_id": "transform.pay-equity.report.v1",
      "unit": "percent",
      "value": 0.366725
    },
    {
      "as_of": "2026-01-31",
      "assumption_ids": [
        "assumption.pay-equity.reference-mode"
      ],
      "caveat_ids": [
        "caveat.pay-equity.reference-mode"
      ],
      "change": null,
      "check_ids": [
        "check.pay-equity.report-contract"
      ],
      "claim_type": "metric",
      "display_value": "1",
      "id": "claim.pay-equity.eu-flagged",
      "material": true,
      "metric_id": null,
      "period": "January 2026 pay-equity snapshot",
      "source_ids": [
        "source.pay-equity.01"
      ],
      "statement": "EU pay-transparency categories at or above the five-percent screen: 1.",
      "status": "caveated",
      "supporting_claim_ids": [],
      "transformation_id": "transform.pay-equity.report.v1",
      "unit": "categories",
      "value": 1
    },
    {
      "as_of": "2026-01-31",
      "assumption_ids": [
        "assumption.pay-equity.reference-mode"
      ],
      "caveat_ids": [
        "caveat.pay-equity.reference-mode"
      ],
      "change": null,
      "check_ids": [
        "check.pay-equity.report-contract"
      ],
      "claim_type": "metric",
      "display_value": "Indicated",
      "id": "claim.pay-equity.joint-assessment",
      "material": true,
      "metric_id": null,
      "period": "January 2026 pay-equity snapshot",
      "source_ids": [
        "source.pay-equity.01"
      ],
      "statement": "Potential EU joint-pay-assessment screen: Indicated.",
      "status": "caveated",
      "supporting_claim_ids": [],
      "transformation_id": "transform.pay-equity.report.v1",
      "unit": "screen",
      "value": "Indicated"
    },
    {
      "as_of": "2026-01-31",
      "assumption_ids": [
        "assumption.pay-equity.reference-mode"
      ],
      "caveat_ids": [
        "caveat.pay-equity.reference-mode"
      ],
      "change": null,
      "check_ids": [
        "check.pay-equity.report-contract"
      ],
      "claim_type": "metric",
      "display_value": "2,023",
      "id": "claim.pay-equity.population",
      "material": true,
      "metric_id": null,
      "period": "January 2026 pay-equity snapshot",
      "source_ids": [
        "source.pay-equity.01"
      ],
      "statement": "Employees analyzed: 2,023.",
      "status": "caveated",
      "supporting_claim_ids": [],
      "transformation_id": "transform.pay-equity.report.v1",
      "unit": "employees",
      "value": 2023
    },
    {
      "as_of": "2026-01-31",
      "assumption_ids": [
        "assumption.pay-equity.reference-mode"
      ],
      "caveat_ids": [
        "caveat.pay-equity.reference-mode"
      ],
      "change": null,
      "check_ids": [
        "check.pay-equity.report-contract"
      ],
      "claim_type": "metric",
      "display_value": "2.7%",
      "id": "claim.pay-equity.raw-mean",
      "material": true,
      "metric_id": null,
      "period": "January 2026 pay-equity snapshot",
      "source_ids": [
        "source.pay-equity.01"
      ],
      "statement": "Raw mean gender pay gap: 2.7%.",
      "status": "caveated",
      "supporting_claim_ids": [],
      "transformation_id": "transform.pay-equity.report.v1",
      "unit": "percent",
      "value": 2.698874
    },
    {
      "as_of": "2026-01-31",
      "assumption_ids": [
        "assumption.pay-equity.reference-mode"
      ],
      "caveat_ids": [
        "caveat.pay-equity.reference-mode"
      ],
      "change": null,
      "check_ids": [
        "check.pay-equity.report-contract"
      ],
      "claim_type": "metric",
      "display_value": "3.1%",
      "id": "claim.pay-equity.raw-median",
      "material": true,
      "metric_id": null,
      "period": "January 2026 pay-equity snapshot",
      "source_ids": [
        "source.pay-equity.01"
      ],
      "statement": "Raw median gender pay gap: 3.1%.",
      "status": "caveated",
      "supporting_claim_ids": [],
      "transformation_id": "transform.pay-equity.report.v1",
      "unit": "percent",
      "value": 3.069167
    }
  ],
  "decisions": [],
  "reviews": [],
  "schema_version": "1.0",
  "sources": [
    {
      "as_of": "2026-01-31",
      "classification": "synthetic",
      "content_hash": "sha256:37cd9325f951ae90fbd6051031982830284138b958e717ac196827cbdc151e64",
      "hash_scope": "file_bytes",
      "id": "source.pay-equity.01",
      "kind": "dataset",
      "label": "Workers",
      "uri": "repo:foundation/data/acme/workers.csv",
      "version": "reference-2026-01-31"
    }
  ],
  "transformations": [
    {
      "description": "Read validated source data, enforce the agent's fail-closed report contract, and produce the semantic report model",
      "id": "transform.pay-equity.report.v1",
      "implementation": "examples.pay-equity.run.build_report",
      "name": "Raw and regression-adjusted pay-gap analysis",
      "version": "v1"
    }
  ]
}
